"","Reviews","Language","Language_score","Sentiment","Mixed","Negative","Neutral","Positive"
"1","Nice story, beautiful photography, excellent acting performance. But the end was really fussy and corny. But we still need stories like that that restore people's faith in true love and their ability to stick together to death.","en",0.991975545883179,"MIXED",0.99779,5e-05,2e-05,0.00214
"2","Many times when someone is born poor, they want to prove much better, be someone, so they become richer than they just fall in their page. There are a lot of stories like that in real life. The film is full of many lessons, it is worth watching, but you have to have some brains to rate.","en",0.997346222400665,"MIXED",0.93478,0.00173,0.00329,0.0602
"3","I just saw it, I liked it. spoiler:There are always such scumbags who deliberately want to screw up the happiness of others (the mother). Can they be stupid enough to think money is more important than anything? That really annoyed me in the movie, I almost mundled my glasses. But human values are much more important. If you have that, you'll have the money later on you. Because then the peak of human existence can be created: happiness plus wealth together. Thank God I got that because my wife hasn't listened to her silly mother in 30 years. It's like I've seen my own story, but the end of it is nonsense. In bed, in pillows together. Now, don't be kidding.","en",0.997239053249359,"MIXED",0.7888,0.04006,0.01184,0.1593
"4","It may be a bit cheese — more like a framework story for the elderly — but I've seen much better.
The two main characters are taking the movie. World literature is full of such “gicsses” stories. Romeo and Juliet, Tristan and Isolde, Orpheus and Euridice and more. These are still working today. In today's accelerated world there is also a need for tales, and it is possible that there are fortunate people to whom the fairy tale happens.","en",0.988941133022308,"MIXED",0.78737,0.0069,0.00574,0.19999
"5","You misunderstand. It is not the love that lasts to the grave that is sentimental, but the way it is presented in this movie in a cheap, pretentious way. Instead of authentic emotions, empty sentimentality.
To give a counterpoint, for example, Richard Linklater's... trilogy (Before the sun rises, before the sun goes down, before the clock hits midnight) is able to show true, authentic emotions without any sentimentalism and pretentiousness through the story of a love.","en",0.9893758893013,"NEGATIVE",0.12484,0.66583,0.01528,0.19404
"6","That would have been a brilliant twist. XD I think I was waiting for something like this, but in vain...","en",0.995759069919586,"MIXED",0.45701,0.34638,0.08593,0.11068
"7","My dear Love, this movie is one of our favorites! Oh, we can cry about it. Wonderful performance from the protagonists!","en",0.990662336349487,"POSITIVE",5e-05,7e-05,0.00046,0.99942
"8","It is unfortunate to apostrophe love to the grave as sentimentalism.
Yeah, it's unthinkable nowadays.
In the past, it was not a rarity for people to live their lives for good or better, even through bleeding times. The number of divorces used to be very low.
Is it time to realize whether we would like our iodine enough? 
We should prioritize what the real value is in our lives... it's important that we choose well...
It's over two hours of film, which, even filled with commercials, may seem like a lot. No wonder a lot of people don't watch it on TV","en",0.995411157608032,"NEGATIVE",0.12659,0.69245,0.14451,0.03645
"9","I read it a lot, it's predictable. Why is the degree of predictability among the primary judgments? In fact, some people just pull it off for that. So all the fairy-tale stories are weak because they're predictable? We watch a movie because we want to be enchanted by something. This movie enchants me, so it wasn't predictable for me. Why? Why? Because I was listening to magic and I didn't step out of the story to think about what was going to happen. And by the way, the film is impeccable in every way.","en",0.995873808860779,"MIXED",0.68621,0.06009,0.00212,0.25158
"10","9.4 for this movie? Is this some kind of joke?
I've never seen such a pretentious, overpriced kitsch in my life. 
my girl made me see how good it was. I look at it, and then I thought, “I must have a woman who likes it.","en",0.997790455818176,"MIXED",0.57413,0.19424,0.06155,0.17007
"11","I've been able to enjoy every minute of it, for the next time. It's probably about the fact that the movie doesn't talk to everyone. I'm sure it's better for those who don't get caught up in a little American kitsch or a little cliché sometimes, or even the protagonist's birthmarks... but enjoy the manifestations of love and passion and, of course, delight in Gosling's game, talent, exterior...","en",0.993184387683868,"POSITIVE",0.45575,0.00357,0.00568,0.535
"12","SPOILER
In the end, I expected it to turn out that the old gentleman wasn't Noah, he was Ron, just playing Noah for Allie's sake.","en",0.991740643978119,"NEUTRAL",3e-05,0.13846,0.84234,0.01917
"13","I would like to bring this film to your attention to my grandchildren Peti.","en",0.989471793174744,"POSITIVE",0.00138,0.02749,0.09944,0.8717
"14","Hmmm! How do I start? The lot of opinions are correct, but in fact, the people who have lived the situation can enjoy the movie. It is true that it can be called a little kitschy, predictable, etc., but after 57 years of similar love conditions, this film is the mirror for us. That makes our 10 points.","en",0.99520069360733,"MIXED",0.48827,0.00581,0.03202,0.4739
"15","That got more points than Titanic? I know it's not exactly a category, but I don't think this movie is the big deal.","en",0.997472941875458,"MIXED",0.41939,0.29661,0.12127,0.16274
"16","SPOILER 
It's an overrated movie. 
mr. Heartbreaker's fashionable, early play is absolutely unconvincing, Rachel and her have no chemistry, which may not be visible because it's still Ms. Hudson. McAdams' career break, this film was the big leap. 
Ms. Bell. McAdams, as they say, gave him his best. Rachel's body, however, because of the Irish and Scottish ascents, has moles in too white and unwanted places, so it is presumed that mr. Heartbreaker takes off stockings from a foot double in one of the “hot” scenes of the film (watch the changing hairdress and how Ryan's wet body dries in one blow during the scene). By the way, staring at Ms. McAdams' rattling ribs is no pleasure. The top is, “I'm gonna take your pants down so you can pick me up upstairs “- that's more ridiculous than romantic. Closing the love scene, Allie is watching her love sleep, although at that time there was no corrective mutt for the septum of the nose, so it's hard to believe that the film “Noah” would not snore into the image of her love. 
Martha and Allie's friendship is surreal, and Allie's remaining volcanic logic unravels her love disappointment. Everyone can express moral heights in words that completely distract the viewer. The screenwriter does not let the viewer feel what the character is thinking: instead he puts the emotional projection into his mouth, rubs it with geometric accuracy and rubs it all in the viewer's nose (see Martha evaluates her potential while Goslin stares with veal eyes and McAdams is jealous at a glance you will get sorting instructions). The arrows are painted on the floor the next morning, which is just plain sorting nonsense.
The characters are not deep enough, their vocations are theatrical, largely lacking in vitality. The one-minute stereotype put into the mother's story is a plastic side rather than an artist. 
The fundamental tension of “film in film” works would be parallel conflict, but instead of creating tension, the film quietly shoots jokes without catharsis. The viewer looks bored at the end of the film, disappointed with the end, and pretty much feels: “Now, we've seen this too”.
If you are looking for a lifely-smelling female character coming back and forth between the real male characters and want to know “how it went before, when there was no Tinder, facebook, viber, etc.”, you should take a look at the worlds of Brad Pitt and Aidan Quinn, where the female character Julia Ormond se is a wretched traveler, in his life: https://port.hu/adatlap/film/tv/szenvedelyek-viharaban-legends-of-the-fall/movie-2301
In the 21st century, such “love nearsightedness” no longer exists, but the forties who scored the film raise their young years - with the tenth votes - to pedestal. I assure them: girls attracted to their Gosling partner don't expect years for a potential orgasm these days, but they just check it out, maybe too fast, without wanting to get married.
Nowadays you don't need a newspaper article to get news of your love back from the front for years. The modern soldier discusses with the family before and after the deployment, if at all he has to leave the country for service, not to control the Middle East drones from the Nevada desert, not to mention the couples of soldiers serving together.
The landscape is beautiful, but the rain from the sprinklers can make the experience forget. By the way, the domestic ducks don't fly anywhere, so I guess the wild ducks didn't want to be on the set, and no trained swans were handy.
Above forty recommended pieces, 6/10 for them, forgettable for younger ones.","en",0.993459761142731,"NEGATIVE",0.00107,0.64842,0.14998,0.20053
"17","I've seen it once, but not from the beginning. It didn't affect me that much. I've just looked at it, and the beginning of the story really struck me, but at the same time the end SPOILER was terribly corny, lifeless, and so it hit me to death. The teenage love thread is quite credible, and those who lack depth, character regression and character development have probably forgotten that teenage lovers tend not to develop along human/moral values, but rather physical attraction and chemistry predominate. At the same time, character development in life is not always guaranteed. I mean, so far, the story is authentic. The end, on the other hand, is a concentrated spill, and so the effect that we managed to create in the beginning completely dissolved by the end. It's a shame, because it could have been done without disappointing me.","en",0.993633210659027,"NEGATIVE",0.24195,0.70748,0.00692,0.04365
"18","It was a miraculous movie and unforgettable.They played their roles credibly, and I believed that it was true love, even if their love was complicated. Let's say, the mother of the elie was surprised to believe that there were secrets of such a woman-woman who strictly insisted that the girl would not pick it up.","en",0.998136222362518,"POSITIVE",7e-05,0.00015,0.00042,0.99936
"19","Agree.:) is not a big sister movie, you can watch it once... Everyone here was ranting about this movie, come on.
I hated Gosling because of this movie.
I liked it better in the winged bounty hunter.","en",0.995707511901855,"NEGATIVE",0.28203,0.37652,0.02676,0.31469
"20","Beautiful, deeply sentimental, sensational acting. 10/10 One of the most prestigious romantic films","en",0.984197497367859,"POSITIVE",5e-05,5e-05,0.00113,0.99878
"21","It's a wonderful film... about true love, unconditional love. 10/10
I didn't like every character in every moment, and is it totally irrelevant whether the story is predictable or not? It is not always possible to invent something completely new, to create! The point is the film to say, and the story, the characters are brought to life. Based on these, you can only talk about it in a high degree... I think<U+1366>)","en",0.994942367076874,"POSITIVE",0.00829,0.00048,0.00044,0.99079
"22","Watchable film, I wouldn't say bad in any way. The only problem I had was that it was predictable, and it was hard to guess the end. Anyway, nice story. Right after the movie, I said 10/7 although after two and a half hours, it's 10/8 for me.","en",0.996296942234039,"MIXED",0.94539,0.0036,0.00095,0.05006
"23","The film, of course, is 10/10 +1, because Ryan Gosling is a bearded frantically handsome man.","en",0.994583010673523,"POSITIVE",0.00048,0.00484,0.04585,0.94883
"24","They don't put the sex scene in for women, so be strong. An emotional-filled film with real drama and a story still has more value than a porn that the moustache and beer-bellied Józsik watched from the age of 12.","en",0.991541504859924,"POSITIVE",0.04114,0.03222,0.04039,0.88625
"25","Overwhelmed suck cylinder. It's only become such a success because Twilight and Fifty Shades of Grey. Women love stories like that because they can get into it. The 15-year-olds fall in love with Rájengoszling, the 25-year-olds have a tingling womb that they want such a guy, the lonely 35-year-olds push ice cream inside crying, the 40s living in a casual, passion-free relationship, and 50s imagine in their dreams that something is really with them something like this happened, and they didn't marry an electrician with a mustache, beer-bellied, named Józsi. 
I'm not saying it's a bad movie or a bad story, it wasn't that bad even with the characters. But his rating is far from so good because it would be such a big movie, but because women are incredibly easy to lead with a little romantic story, especially if you add sex scenes into it. It's a clear success, it can be any flat fostenger behind it, if there's sex, love, crying and screaming, it's already won. Oh, and of course, the huge social difference, which is also present in all these films, because the real story is only if one is rich, the other poor (or vampire) and at least half of the parents are definitely against it. Girl rebellion, that's what needs, especially for someone who has never done it in their own life. Yeah, and making out in the rain. Instant orgasm for women sitting in front of the TV, and they are already pushing 10 points. 
Of course, there is nothing wrong with this, every style has its own target audience, such is the film industry.:)","en",0.995834589004517,"NEGATIVE",0.12987,0.78775,0.03308,0.04929
"26","I think it was a study film.Love is capable of miracles.Unfortunately, in today's vil`ag this is not an option but it is a beautiful film. 10/10","en",0.98779296875,"MIXED",0.82799,0.00055,0.00043,0.17103
"27","I'm not going to sing prayers about the film, I need to see it. What does true love do to a man...
One of the best, if not the best romantic films.
9/10","en",0.995425224304199,"POSITIVE",0.00578,0.00235,0.01888,0.97298
"28","It's a very nice movie. I'm glad I watched it. The actress who played old Allie is the director's mother, I've seen many of her films, she's a great actress. And Ryan Gosling, who plays young Noah, is at the top of the Top 15 male ideal list.","en",0.997247874736786,"POSITIVE",2e-05,5e-05,0.00033,0.9996
"29","It's a beautiful movie, I cried on it, I felt it, and it's really terrible how soon the time passes, and if other couples watched it, they thought they could grow old like this.","en",0.997710824012756,"MIXED",0.68382,0.01016,0.00068,0.30533
"30","No one can understand who was not.1 very, truly in love 2. he did not have to choose never in his life 3. he was never forbidden from anyone he loved 4. and can not imagine himself a deadly, incurable patient.. I almost write.. there is no 60 years.Very rarely there are young people who can 60 years old to think, but it's really rare. It's hard to imagine this life situation until you have a 60-year-old minimum. And then almost everyone knows what it's about. Heavy. But whoever was at some point knows, feels, understands.","en",0.996232688426971,"MIXED",0.49708,0.13033,0.17568,0.19691
"31","It's a beautiful movie, I love it. It's not the first time I've seen it, and it's not the last time!:)
Anyone who doesn't understand this film is his spiritual poverty, and I can only regret it.","en",0.997032761573792,"POSITIVE",0.00012,0.00016,9e-05,0.99962
"32","I've heard a lot of good things about this movie. It was a huge disappointment. It was torture to watch. Terribly boring, predictable ending and too cheesy movie. I don't understand how this could be the “most beautiful movie in the world”...","en",0.992696464061737,"NEGATIVE",0.00015,0.99964,9e-05,0.00012
"33","trudy described everything about him in front of me about the film... incomprehensible enthusiasm... too hypeated","en",0.980473399162292,"NEGATIVE",0.00046,0.9863,0.00308,0.01015
"34","I don't understand why this film is so popular.
If you've seen or read a love story from your classic pen, I simply don't understand how you can be a buyer.
We do not learn any human character from the main characters except that the girl is rich and the boy is poor. Their relationship doesn't even know what it is that brings them together and then holds them together. All we know is that they fight all the time, but they love each other very much. In addition, the big “love” that has affected their lives and what they've been shaking back for years is actually just a little summer fling, where nothing happens between them bathing in the lake and looking at the stars. Of course, you have a young head, but that's what makes you a mature adult man. There is no development of character here either. The girl remains the same hysterics all the time, and the boy is a sheep-wearing slippers who can endure everything for love.
When a girl meets someone else in the beginning, we don't even know what kind of person she is, except that she's very rich. There is no real love triangle conflict.
Doesn't it turn out that the girl was eventually disowned from her wealth and chose poverty? Or do parents recognize their love? The only conflict arising from their social situation will eventually remain unresolved.
I sat at him with great hopes, but all I got was an inflated, improbable, empty lemonade. But what I'm a little angry is that the film takes place at an age and has elements (e.g. war, wealth status) that make you get the illusion of a meaningful film.","en",0.996069967746735,"NEGATIVE",0.11929,0.86471,0.00241,0.01359
"35","It's beautiful, but I think it can only be recommended to the spiritually strong...","en",0.995113790035248,"MIXED",0.98899,0.00063,0.00037,0.01002
"36","Beautiful film, I recommend it to all!!! the book I read, the film 
on the basis of this is a great order, the actors are wonderful!","en",0.985289096832275,"POSITIVE",3e-05,3e-05,1e-04,0.99985
"37","It's a wonderful movie. Immersive, simply fantastic. During the film, the number of handkerchiefs fell, but it was worth it. I recommend it to everyone who likes romantic movies.","en",0.98887300491333,"POSITIVE",9e-05,2e-05,8e-05,0.99981
"38","It's just a situation with me, when I hugged and caressed my partner, he came out of it, and all he said to you was a cat, so he wasn't a romantic kind...","en",0.998323917388916,"NEGATIVE",0.02967,0.4981,0.43418,0.03805
"39","I think it's one of the best romantic movies ever. I recommend it specifically for ladies or couples (where the guy is of a more romantic type).
I'm not much of a romantic movie fan, but it really worked for me.
He's been busy all along.","en",0.997308731079102,"POSITIVE",0.00065,7e-05,0.00092,0.99837
"40","It's not a bad movie, it's good as long as they get together, but it didn't get me that much, even though I'm a man. I didn't like the old people in it either. The characters weren't sympathetic either. Walk into the past, I think, is a much nicer and more dramatic film, since N. Mr. Sparks.","en",0.996815383434296,"MIXED",0.95446,0.00208,0.00051,0.04295
"41","I agree! But not only the love thread has strung away from reality, the illnesses of the old lady (dramaturgy and pretentiousness are the only aspect here unfortunately) 
Yes, “One Day” is 100X better film. The “Cinema paradiso” on a similar topic is also 150X.","en",0.988560438156128,"MIXED",0.79287,0.09958,0.02944,0.07811
"42","You can read it here: https://hu.wikipedia.org/wiki/Szerelm%C3%BCnk_lapjai
but the article above is, of course, complete spoiler, read only by those who have already seen it or who do not bother!","en",0.996546566486359,"NEUTRAL",0.00421,0.18213,0.7999,0.01376
"43","I started to write out how good and well-done film I had just seen (this), but seeing the record score and a few fresh hints, I don't even attempt it. Everyone has already taken precedence and written out everything. The film is not only beautiful and good, but also authentic, I mean, the whole milieu, sets, costumes, acting, everything. The director boy arranged his own mother well and all (who) other things. The very end, however, must have been misused, because I had to find out from the Wikipedia article that... so AZ.","en",0.994577527046204,"MIXED",0.84082,0.09043,0.00157,0.06719
"44","I didn't mean specifically for this movie, I meant it in general. They cut the ends off from almost everywhere. In many films, the credits end is about 2 minutes, and they are cut off without heartache and put in a commercial instead.","en",0.997210919857025,"NEGATIVE",0.08176,0.86956,0.00454,0.04414
"45","Did it hurt you that I put a label like that on it?
it wasn't meant to be degrading.","en",0.998227834701538,"NEGATIVE",0.06507,0.80606,0.09518,0.03369
"46","My dear, of course this is a crying film:) that is, a film in which the screenwriter and director lead viewers with well-calculated storytelling and pictures until the women sniff freely, and we discreetly adjust our glasses or go out to pee.
By the way, I like good crying movies, although that's a little feminine, but luckily I'm sure of my sexual preferences.","en",0.996575891971588,"POSITIVE",0.17233,0.21989,0.10075,0.50703
"47","Not at this point, but there are a lot of movies where there are still easter eggs during the credits, for example, in the Mindeelves.","en",0.996902287006378,"NEGATIVE",0.2835,0.34858,0.34601,0.0219
"48","I think it's a disgusting habit for the end headline to be cut off entirely from everywhere, the credits, the musical accompaniment, etc. But advertising blocks are getting denser and longer.","en",0.994479179382324,"NEGATIVE",0.15085,0.84071,0.00476,0.00367
"49","It's the first time I've seen it! But it was a shame to lose those few seconds.","en",0.998214662075043,"NEGATIVE",0.42973,0.45926,0.02188,0.08914
"50","The mother of qva to the cool! There's a lot of commercials and the end of the movie was missed!","en",0.997430801391602,"POSITIVE",0.04745,0.22626,0.08449,0.6418
"51","Nicholas Sparks is one of the best successful pieces of crying movies, by the way, on a conveyor belt.","en",0.995008528232574,"POSITIVE",7e-05,0.00027,0.00913,0.99053
"52","Because I was shocked at how high his score was (I don't know, but could this be our country's favorite romantic movie?) I've been watching a romantic movie, which is not common. Well, that was really good. The girl wasn't my favorite before, but now she was a big one, and I believed her...","en",0.997923076152802,"POSITIVE",0.37737,0.02392,0.03972,0.55899
"53","It's a nice and thoughtful film about a relationship that has died and reanimated several times. Unfortunately, the last scene was very predictable. Basically, I liked the film, but in some places it moved into the “exaggeration” category.
despite all: 9","en",0.995755553245544,"MIXED",0.96155,0.03704,0.00022,0.00119
"54","“Fortunately, I've seen a romantic movie without frosting and frosting.” I'm very interested in that. Would you like to share the titles of some of these movies with me? Thank you in advance!","en",0.997872233390808,"POSITIVE",9e-05,0.00224,0.23365,0.76402
"55","I agree with your comment, but I also respect Phantasia's opinion (this is called diplomacy).","en",0.987723290920258,"NEUTRAL",0.34512,0.03832,0.4805,0.13606
"56","And when the end of the film is cut off by the dear channels... the feeling... “invaluable”.: ((((","en",0.996083855628967,"NEGATIVE",0.00112,0.99507,0.00297,0.00084
"57","Fortunately, I've seen a romantic movie without frosting and frosting.","en",0.9953293800354,"POSITIVE",0.00015,0.00368,0.00742,0.98875
"58","This is the second time I've watched the movie. I really liked it. 10/10. I like to read comments, amuse how much self-proclaimed film stakes, film critic and soul divers etc. express opinions. It's a bit like admiring a painting, and three or four of them jumping up and explaining that I don't like it, of course, explaining why. And it fascinates me when I read that the human soul (for example, mine) does not work as I think (of myself). In vain, you always learn...","en",0.994645297527313,"POSITIVE",0.00063,0.00309,3e-04,0.99598
"59","To do that, you have to go out on the street, live an active community life. ;)
Romantic film and no frosting, you have to take care of this without any frosting...","en",0.99658328294754,"MIXED",0.4588,0.01646,0.07937,0.44536
"60","I don't know if I have any idea about love, but I do know that the human soul does not work as it is depicted in this movie. That's not how real people react to what's happening. Charming is a big 0 in this movie. Others can calmly plunge into the frosted dream that this film presents as love, but when I watch a movie, I'm more inspired and inspired by real, complicated, deep, human emotions.","en",0.996959805488586,"MIXED",0.75468,0.07266,0.00591,0.16674
"61","I'm glad we agree. The only reason I watched this movie is because every girl I know is raving about it, and it's still a mystery to me why. Otherwise, I would have turned it off after about the first five minutes. I'm not a big fan of Rachel McAdams, but I think this is by far the worst movie I've ever seen from her. If you want to see a romantic movie that is about something, I recommend Onde day.","en",0.996401488780975,"MIXED",0.91779,0.07284,0.00072,0.00865
