"","Reviews","Language","Language_score","Sentiment","Mixed","Negative","Neutral","Positive"
"400","There is a quote from the film: “Summer adventures end for many reasons, but all in all, they have one thing in common: shooting stars, majestic, unrepeatable moments, the flash of eternity that goes away in a minute”","en",0.990954995155334,"NEUTRAL",0.03021,0.0671,0.78983,0.11285
"401","There are more of these films, but of course you have to look for them as precious stones, but that also changes if you find them, it's not certain that they give you the ruby, someone, someone the sapphire, someone the emerald, someone the diamond does better, and it's really impossible to say universally that one is more beautiful than the other,just as it's not absolute for movies.
because each one opens up different dimensions, but from above it's easier to see everything, and once you've experienced things from the top where you see a lot more clearly, you'll notice the difference.","en",0.996281385421753,"MIXED",0.95637,0.00702,0.00293,0.03369
"402","I cried in the film Walking in the Past, and I cried on it.
I'm reading the book now, and I hope it's just as good.
We need more films like this these days.","en",0.997549951076508,"POSITIVE",0.00107,0.01437,0.01841,0.96614
"403","It's a very special movie, and actors add a lot to it.
He's outstanding among similar films. You should not miss it!","en",0.991131365299225,"POSITIVE",0.00013,0.00011,0.00149,0.99827
"404","I've never seen a better movie, even though I don't think I'm so romantic, but the characters are so good about the story, not to mention no.1!!but the way I look at this movie can't not be loved-everyone liked it regardless of gender...","en",0.99481588602066,"MIXED",0.88566,0.00939,0.00209,0.10286
"405","This film was very beautiful (L) (: it is a pity that this true love is not for many people.","en",0.994596838951111,"MIXED",0.79526,0.02725,0.00681,0.17067
"406","There's another movie that's also Nicholas Sparks
based on his novel as the pages of our love, this cime walk into the past, who has not seen it, it is as good as this movie, although it is also such a love story based rather but very romantic I highly recommend.. when people talk about the great He many times then I used to say For them children, look at the pages of our love, and you understand this nayg He question because your information is wrong.. because I actually think that the one who is next to us at our deathbed and holding our hands, and this film is a perfect example.. ya and that there is no such guy as noah? this is just like the cliché “all guys are diwords”, which may be true, but only if you've met everyone.","en",0.996403157711029,"POSITIVE",0.43865,0.03579,0.01214,0.51341
"407","http://MODERÁLVA/showthread.php?t=61995&page=400
Hey!I downloaded it from here, with true subtitles.
I think they're both very good movies.
I cried at them all, I love movies like that.","en",0.988589107990265,"POSITIVE",0.00105,2e-04,0.00406,0.99469
"408","It's a very good movie. It's one of my favorites.
The comments show that unfortunately the girls/women say that today there are no men like Noah in the movie.
I'm sorry. You must think that for a reason.
But there may still be one - two chivalrous, trustworthy men...","en",0.995457172393799,"MIXED",0.82691,0.00388,0.00167,0.16754
"409","Kitty 92
If you haven't gotten the film yet, I have it. True divx, I downloaded it from the Internet. 
I don't know if you're from Budapest or not. I'm Pest. 
If we can arrange a reunion, I'll be happy to write it to you. 
Write to adamkata67@gmail.com.ra. 
Yeah, and I'm obsessed with a movie called “End of a Relationship”, if you have any info, I'd like to thank you.
Hello: Kata","en",0.993581354618073,"POSITIVE",0.00019,0.00167,0.31464,0.6835
"410","It's a really good movie, but it's more like girls. I've seen it 20 times, but you don't get tired of that kind of guy on earth.","en",0.998183012008667,"MIXED",0.837,0.00356,0.00386,0.15559
"411","Thanks!:)
It's irrelevant how much it costs.
This movie must be really good, so I definitely want it.
That was just an extra posityvum for a cool movie, and yay 990.:)","en",0.991892039775848,"POSITIVE",6e-05,0.00023,0.00045,0.99926
"412","I don't know how I found this movie anymore, but it just happened. I've been hunting it ever since.
You could buy it at Saturn for 990, but of course I was gone. But there's nowhere else.
I've been to Arcade, Mammut, looking everywhere.
AAAAI so much want to see it. It's just like this for me:)","en",0.995830357074738,"POSITIVE",0.00889,0.04687,0.02063,0.92361
"413","I first saw him in America, and there were all old people sitting in the audience. Now, I'm telling you, I sat on a crying movie again...<U+1366>) And really... I loved every minute of it. It's just beautiful, I couldn't highlight a favorite part, but maybe what I liked best was when they boated and it started raining, and then Allie started yelling at Noah about why she didn't text her. Oh, I was more eager—","en",0.997787594795227,"POSITIVE",0.47948,0.02191,0.00457,0.49404
"414","Love it, love it, love it!It's good that there are such creations!In the story, the characters are all very in one!!!I hope I have many more films like this.","en",0.995987176895142,"POSITIVE",0.00012,3e-05,1e-04,0.99975
"415","I'm a 23-year-old boy, and yes, I have a burst of the candle, 
SPOILER PLACE
but it was really broken when the nurse found them in the morning... I have this film out of 10 1000!!!","en",0.99759179353714,"MIXED",0.63755,0.09853,0.00598,0.25794
"416","SPOILER PLACE
I wrote it here, not so long ago, and then I read the film, and I saw it was based on a book! I immediately went to the library and read it in 1 day! It's terribly good. It's a little different from the movie, but I couldn't tell you which one is better! I was convinced that the beautiful quotes of the film were from the book, and no! Not at all! It's the movie's own, and it's beautiful. The book, on the other hand, is different, more detailed, and you can see things better. And in the book, they don't die in the end! You're still living the same catharsis. And needless to say, I cried all over the book. Very good! If someone wants to have time to read it, do so because it's worth it!!!","en",0.997342824935913,"POSITIVE",0.02119,0.02348,0.0015,0.95384
"417","I just finished the film five minutes ago, and I quickly signed up here so I could finally vote and comment on a movie.
For the record, I don't like romantic movies, it's not my thing. But this movie... He simply dragged me, twisted, twisted me, and made me write. I've never seen a movie like this before, and I've never cried so much in a movie. (Okay, maybe on the Titanic at the age of 10.)
So I have this movie 10/10. It's a wonderful love story, the quotes are nice and the music is good.
See everyone:) It's a big mistake to miss.","en",0.996479868888855,"POSITIVE",0.00204,0.00036,0.00096,0.99663
"418","I saw the movie yesterday, but I really liked it! The male protagonist was very good, his women looked a bit like Hillery Svank to me, but they were very good! But at the end (about the last 30 minutes) I cried almost the whole time!
It was very touching. Especially the old themselves! Young people also “sold” love, but old Noah was very good! I believed him this could happen! It's a very good movie. And I've been wanting to watch the movie “breakage “for a long time, but now that I realize that this guy is playing in it, I'm increasingly thinking I need to see that too! But in a romantic movie this is Nr.1!!!","en",0.99655020236969,"POSITIVE",0.05836,0.00119,0.00021,0.94024
"419","how will I go to work tomorrow with such eyes???? There's no chamomile tea that can help me with this... it was wonderful, I didn't cry... I roared:D","en",0.997336208820343,"POSITIVE",0.00172,0.01121,0.03119,0.95589
"420","I downloaded the movie yesterday, and I couldn't bear not to watch it! I've been waiting for him for about a year, I haven't heard anything from him, I only saw his soundtrack on YouTube and fell in love with him. The movie ended in the evening, and I watched about half the time I could fall asleep, I was so influenced!! 
I don't like the sappy... cliché love movies, and I was worried it would be, but no, it was really good!! I cried so much in the end!! It's unconscious, the way they look at each other, they feel so much. I remembered my first great love, which ended about three years ago, and we loved each other the same way, but I wasn't as strong as the girl in the movie, and I ruined it and it ended. Since then, I have had relationships, and I still do, but the first love came to mind when I saw the movie!","en",0.997912526130676,"POSITIVE",0.0019,0.09333,0.00137,0.90339
"421","jaaah and Gosling took me off my feet:P it would be nice if I were her:) I want this kind of love!!!! :D","en",0.996900200843811,"POSITIVE",0.001,0.00083,0.01702,0.98114
"422","divine film, I loved it, the best romantic movie I've ever seen!! 10/10","en",0.974672794342041,"POSITIVE",5e-05,3e-05,0.00025,0.99967
"423","It was a very beautiful story, I really liked it. It was worth 10 for me.
And I found your book on Alexandra's website.","en",0.993069052696228,"POSITIVE",3e-05,3e-05,8e-05,0.99986
"424","It's a very good movie I can recommend. My book 10/10","en",0.973850071430206,"POSITIVE",2e-05,3e-05,0.00015,0.9998
"425","You're absolutely right, I also liked it:) A good story that kept my attention all the time, the film is predictable, but this does not lose a bit of its value 10/10","en",0.994149208068848,"POSITIVE",0.07379,0.00025,0.00057,0.92539
"426","I saw it yesterday. It was so good! do not please everyone in vain! I get 10/10 points. 
I can only recommend it to everyone:)","en",0.994916021823883,"POSITIVE",0.00397,0.00366,0.00735,0.98503
"427","This is the best love movie ever! Even men like it! :D
Does anyone know where to buy the book that was based on?","en",0.996972262859344,"POSITIVE",5e-05,5e-05,0.00073,0.99917
"428","I just saw him again... incredible, unconscious, I can't get enough of him...","en",0.996869087219238,"POSITIVE",0.0026,0.13679,0.10275,0.75786
"429","It's a nice and touching movie, but for some reason it didn't work out for me. I found it boring in some places, so it's 8!!","en",0.998060345649719,"MIXED",0.99396,0.00433,0.00016,0.00154
"430","The best movie in the world...There's only one thing I don't understand:
Why didn't he get an award? Or did you just not mention it?","en",0.997166514396667,"POSITIVE",0.03854,0.01963,0.13033,0.8115
"431","I saw it with subtitles, really nice film, showing the forties... About the only thing I didn't like about the ending scene was closed— I don't know why... I mean, it ended up in a room.
Rachel McAdams is super:)","en",0.99559098482132,"POSITIVE",0.06128,0.00222,0.00841,0.92809
"432","It just ended, I mean, the movie. It's a very beautiful film, and in our current rushing world, it opens the eyes to see which things are really important in life.","en",0.996518909931183,"POSITIVE",0.00047,2e-04,0.00059,0.99875
"433","I love this movie the first time I've seen it I haven't cried but the second time it's incredible for about half an hour, and you wonder why there's no more Noah?!!!:)","en",0.997074484825134,"POSITIVE",0.00022,0.00026,0.00021,0.99931
"434","I bought the movie on DVD today, I've seen it a day or so...
Media Mark is now available on DVD for just 990 HUF!","en",0.990736067295074,"NEUTRAL",0.00034,0.02135,0.49952,0.47878
"435","This is my favorite movie.
I've always been at least half an hour at the end...
the actors are very good, too. No 10 out of 10!!!","en",0.996574938297272,"POSITIVE",0.01362,0.00198,0.0011,0.98329
"436","I've never seen a beautiful, touching, heartfelt film like this in my life.","en",0.988948702812195,"POSITIVE",0.00015,0.00282,0.00141,0.99562
"437","port.hu is there no such toplist as IMDB? I'd love to see it, I think, over 50 votes, not many films have a better average than this one, maybe just the prisoners of hope. And really, deservedly, this is how good the average is.","en",0.995990455150604,"POSITIVE",0.19207,0.1172,0.14262,0.54812
"438","Ryan has great movies, for example. Breaking (Antony Hopkins), Plastic Love. His synchronous voice was Zoltán Miller and I think he was hit very well!","en",0.970202744007111,"POSITIVE",3e-05,0.00029,0.00206,0.99762
"439","I watched it this afternoon and I planned to see it again in the evening because I liked it so much that I wanted to see it a second time, but I couldn't stand it. I just couldn't stand it. Incredibly good:)","en",0.998061001300812,"POSITIVE",0.01016,0.00145,0.00052,0.98786
"440","Her partner, Rachel Mcadams, was her girlfriend for years, and unfortunately, they broke up ever since, although we don't know why.","en",0.992506206035614,"NEUTRAL",0.00177,0.24078,0.75531,0.00215
"441","I was so surprised by what you wrote...)I saw it in August 2007 and I cried so much that I couldn't bring myself to watch it again.","en",0.998642444610596,"POSITIVE",0.00101,0.36627,0.00737,0.62535
"442","SPOILER
It was a little strange to me, like when a guy would climb on a carousel just h an unknown chick would date him. I mean, it was an exaggeration, and what guy would have had the house done after seven years the way his old love wanted it to be.
Unfortunately, we don't really meet this kind of thing anymore, maybe that's why I felt this part of the film a little too much.
by the way, a pleasant love and touching film:)","en",0.996262550354004,"MIXED",0.81973,0.12858,0.01451,0.03718
"443","Very good movie, touching story! I loved it! In the end, I cried too! I've seen many of you have written Desire and Apenance as a comparative example! Of course, I know we're different, but how do you mention two films on the same page? I've seen the desire and the penance, and I can only say I wish I hadn't looked at it. The only good part is when the chick “tries” the guy in the library, only that annoying little sister disturbs them (that's not a good part)! But, of course, I almost said to the end that it wasn't so bad when they were supposed to be together. But that the whole “happyend” is just a fiction!? Hey, Pfff. The whole movie was really bad. Now, I'm sorry for everyone that I offended, and for writing it here, because I know this is not the forum! 
By the way, I can only recommend the pages of our Love to everyone! Divine!10/10","en",0.996133506298065,"POSITIVE",0.04362,0.00193,0.00029,0.95416
"444","I've never cried on a movie like this. Although there are some things that I can make easier to look at, like, Desire and Atonement, but it's never been. After it was over, the credits went down, but I was still staring at the dark screen... The acting performances are wonderful, the cinematographer work is also perfect, the music is always in place.
I've seen a lot of romantic movies, but it was somehow different... 
—Spoiler—
I started tearing at the scene where Noah took the girl out to the lake and said, “They're leaving.”
—Spoiler off—
And this is where you have to praise the sync. He had a very good English voice, especially the guy.
And I don't know where Ryan Gosling is right now... after looking at the IMDB, I was shocked to see that he was nominated for an Oscar in 2007. Honestly, I haven't heard of it yet, but from now on, I'll monitor what you're doing.
I loved it, but I don't know if I can get myself to look at it a second time... I'm sure he needs to rest from the experience, and then I'll see...","en",0.997454762458801,"MIXED",0.90256,0.00406,0.0012,0.09217
"445","I really liked the film, although frankly I was a little bored at the beginning, but by the way 10/10...:)","en",0.996364831924438,"MIXED",0.94664,0.00011,0.00042,0.05283
"446","It was a great movie. It's a different pattern of rest. It's good casting.","en",0.994369983673096,"POSITIVE",0.00013,4e-05,0.00018,0.99965
"447","Well, this movie...This is not typical American nonsense.
And already at the very beginning I was interested in what the final outcome would be. 10/10","en",0.995280861854553,"POSITIVE",0.00202,0.00432,0.00365,0.99001
"448","I see everyone here likes the movie, so it might be weird, but I don't. For some reason, I was bored with the movie. I always crammed it. Of course, maybe it was because I thought of seeing it late at night. Because, by the way, I like romantic movies (for example: Walking into the past, Titanic, Desire and Atonement... etc.)","en",0.996810555458069,"MIXED",0.68362,0.23208,0.04456,0.03974
"449","not only the film is good, but also the performance of the actors, they play unconsciously well with me this 10/10","en",0.995006740093231,"POSITIVE",9e-05,7e-04,0.00094,0.99826
"450","I think this movie is the best movie of all time, 10th times as good as the first and never get tired of it!!!!","en",0.998111546039581,"POSITIVE",0.00013,8e-05,0.00022,0.99957
"451","In the end, I cried very much, but it was worth it.
Bunny, they call Duke so Allie doesn't know she's Noah.
The actors have braved, but all of them.","en",0.996496438980103,"MIXED",0.63913,0.0091,0.00916,0.34261
"452","SPOILER!
Am I that stupid now...? in the end, the already old Noah why is called Duke????????????????but only I came to mind this question??everyone understands this????
by the way I liked it very much, I cried from half to end!!!!","en",0.997856080532074,"NEGATIVE",0.01929,0.92702,0.01785,0.03583
"453","Hi, guys.Anyone who read our love pages in a book, and the walk in the past could write for me which was better?Heartless?because as I read their content, I know it doesn't mean much, I liked the pages of our love much more! And I'd like to ask if the book version of the film Walk into the past doesn't have the same title but the longest road?thank you very much in advance!","en",0.99542772769928,"POSITIVE",0.00057,0.01331,0.03403,0.9521
"454","Well, whatever you say, I think this movie is one of the more romantic love stories (my favorite).I'm actually touched by this film, and it's really a recognition for both the actors and the director, I guess I'm not the only one who thinks so.","en",0.997504591941833,"POSITIVE",0.00035,0.00072,0.00311,0.99583
"455","I really hate romantic movies, but the Notes of Love have become a beautiful creation. It's an incredibly moving and real movie.","en",0.99556976556778,"POSITIVE",0.11543,0.00031,0.0023,0.88196
"456","Hi, guys.
I'm looking for this movie, because I didn't see it, but the parom told me how moving this film is...
If someone could write me on a DVD,
It's a freak!
I'll set up the coltsegs.
Nagykoszi, Spiceyhinter@freemail.hu","en",0.978559017181396,"NEGATIVE",0.00158,0.53266,0.3819,0.08386
"457","Hello, hi, I want to surprise a friend of mine with this film.Who has a good quality synchronously interested in it. I would buy it if you could write me one. somogyi.sandor@freemail.hu","en",0.984539330005646,"POSITIVE",0.00081,0.00092,0.08159,0.91668
"458","Unfortunately, I didn't like it, but it would have been nice to have another movie that I could pull out sometimes if I had one. I don't like the guy in the first place with that Huckleberry Finn face, and I don't like that jampecy, smooth, braces, box-car era in which it takes place. It's too far away for me, I can't get into the role of the characters, just like the Romeo and Julia story keeps me cold. The fact that everyone here is unimpressed by the film is not particularly impressed, it has never been able to influence the opinions of others, and although I sat down open and with good intentions, I quickly became anxious, because I began to feel more and more that it was not nearly what I wanted. It's sad to say, but I couldn't wait for it to end. This film is for those who have never met true love, only have ideas about it. I will stay with the masterpiece Walking into the past, because there is no film like that in this category.","en",0.997189879417419,"NEGATIVE",0.00741,0.99106,0.00053,0.001
"459","Dear All!
As a Nicholas Sparks fan, I recommend to your attention the 4th filmed novel.
Hungarian title of the novel: At night on the beach
Started in America a few days ago. We're supposed to be October 30.
moderated
One viewers opinion:
Best Love Story of the Year
by neccie_09
I loved every minutes of this movie. I am not real big on love stories but Nights in Rodanthe is like ""The Notebook” of 2008. Richard Gere and Diane Lane have to perfect chemistry. This movie will have you in tears. Every moment of this film is telling the truth about love, forgiveness, and scarfice just saying love can come into our lives when we at least expect it
Anyone who wants to have a sigh Notebook dexterously (movie, book) or Nicholas Sparks cleverly read my comments from last year or write to me.
Have a nice day","en",0.989021182060242,"POSITIVE",0.00265,0.01363,0.01956,0.96416
"460","I read when this movie was going to be, and judging by the title, I thought it would be good. I watched it, and it's my favorite ever since:) It's too bad that such perseverance is only in the movies!","en",0.998140692710876,"MIXED",0.87575,0.03178,0.00066,0.0918
"461","Well, I was skipping school, and when I saw on the show that it was going to be and I looked at it, I realized I was totally right not to go in:))","en",0.999442577362061,"POSITIVE",0.01576,0.13761,0.12709,0.71954
"462","Perfect movie I accidentally watched it but if I can download it!
about true love and perseverance! this is yes!!!","en",0.995132565498352,"POSITIVE",0.00022,0.00011,0.00386,0.9958
"463","I watched it by accident, but it was worth it, it became a favorite:))
Wonderful film!!!!","en",0.996096432209015,"POSITIVE",1e-04,4e-05,0.00027,0.99959
"464","Well, that was something beautiful. True love is beautiful, but it's a pity it's a miracle now.","en",0.996166467666626,"MIXED",0.78931,0.00221,0.00147,0.20701
"465","It was a great movie. And someone says that romance is forgotten... simple, there is no need to be ashamed. Apparently, the editors in the main show are a little shy.","en",0.994876801967621,"MIXED",0.89654,0.00199,0.00069,0.10077
"466","it's not for nothing that this film has so much to please everyone, it's almost 10 votes, but it deserves it, I've seen the film six times, but I don't get tired of it!!!!","en",0.99723619222641,"MIXED",0.69669,0.05064,0.01669,0.23598
"467","today I saw this film for the first time. I really liked it! I didn't see it from the beginning, because I just found it accidentally. It's too bad that the end was cut off... I thought it was just like that, but then on youtube I was able to watch the last scene. I wept at the end, I wondered at myself...:) VERY GOOD FOLM!","en",0.997558295726776,"POSITIVE",5e-04,0.00087,2e-04,0.99844
"468","I really liked it, too. It's pretty bad that they cut the end off... I don't like that.","en",0.999217212200165,"MIXED",0.97731,0.01799,0.00015,0.00456
"469","I really liked this movie.
I thought this was the end of them dying together, but it seems like a call-in show is more important than screening a good movie.
I think I'm gonna get it because it's really hearty and sometimes you can at least be reluctant because of these films from the daily rushing world where there's less and less romance.","en",0.997155547142029,"POSITIVE",0.13377,0.00188,0.00047,0.86389
"470","It was nice, I switched it there completely by accident, I don't even watch RTL, maximum sports or knowledgeable people, but it was worth it!
By the way, is that what happened in the movies?","en",0.996246695518494,"POSITIVE",0.07044,0.0083,0.00608,0.91517
"471","SPOILER
Well, the end is that they die side by side and find them dead... I think that's the most beautiful part, everyone gets touched and surprised how this is possible. They cut about 2-3 minutes, so I don't understand it (even though I cried there).Now it was necessary to cut off these three minutes to avoid slipping and start the Monica show later... I think you should watch it on DVD because it's really worth it.","en",0.996338963508606,"MIXED",0.78587,0.05501,0.00348,0.15564
"472","What else was in the end?
I just joined the last hour... I'm not crying, I can't say that anymore. I have to get this movie, that's it. I'm still under his influence.","en",0.999309062957764,"NEGATIVE",0.15465,0.32803,0.27877,0.23855
"473","Oh, it was nice, but it was good. I had seen it for the first time, but I wanted to see it for a long time. Can someone please describe how it ends? About how many minutes did they cut off? thanks","en",0.998107492923737,"POSITIVE",0.06737,0.00689,0.05242,0.87332
"474","Wow, that's a really good movie. I wish it didn't remind me of someone.","en",0.996553838253021,"MIXED",0.90822,0.00519,0.00105,0.08553
"475","I've seen a lot of movies, but nothing more than this film reflects true love... my tears rained nicely in the end:)","en",0.994503557682037,"POSITIVE",0.01317,0.00288,0.00733,0.97662
"476","This movie is perfect!! I'm almost sure it's the most beautiful romantic movie I've ever seen!! It's a beautiful story, and the whole movie is wonderful, with the pictures, the actors...
It can only be recommended, moreover, to watch again and again! You feel that you're alive afterwards.The one who's not affected can only be a zombie or a droid...","en",0.995363891124725,"POSITIVE",0.00015,6e-05,4e-05,0.99975
"477","Such a crap channel... is unbelievable. With these cuts, the quality of the film is reduced. The end of the whole movie is the most touching, and they cut it off. Well, I can only congratulate them, I want to sue them.","en",0.996816694736481,"NEGATIVE",0.00365,0.99459,9e-05,0.00167
